{
  "benchmark_version": "1.0",
  "run_timestamp": "2026-09-05T20:18:58.737266+00:00",
  "datasets": [
    {
      "dataset": "retail_sales",
      "domain": "retail",
      "rows": 6,
      "columns": 9,
      "pipeline_status": "completed",
      "semantic_label_accuracy": 0.7778,
      "domain_accuracy": 1.0,
      "date_resolution_accuracy": 1.0,
      "pii_recall": 1.0,
      "pii_metrics": {
        "pii_true_positive": 0,
        "pii_false_negative": 0,
        "pii_false_positive": 0,
        "pii_recall": 1.0,
        "pii_precision": 1.0,
        "raw_pii_leakage_count": 0,
        "leakage_detected": false,
        "pii_columns_detected": [],
        "pii_columns_expected": [],
        "pii_errors": []
      },
      "cleaning_metrics": {
        "cleaning_accuracy": 1.0,
        "duplicates_removed": 0,
        "missing_values_before": 0,
        "missing_values_after": 0,
        "dtype_corrections": 0,
        "row_count_before": 6,
        "row_count_after": 6,
        "cleaning_passed": true,
        "cleaning_errors": []
      },
      "eda_metrics": {
        "eda_accuracy": 1.0,
        "stats_verified_count": 6,
        "stats_total_count": 6,
        "charts_generated_count": 6,
        "charts_verified": true,
        "pii_excluded_from_eda": true,
        "eda_errors": []
      },
      "ml_metrics": {
        "ml_behavior_compliance_score": 1.0,
        "model_training_status": "SKIPPED_INSUFFICIENT_DATA",
        "ml_ran": false,
        "ml_applicable_expected": false,
        "target_matched": true,
        "task_type_matched": true,
        "metrics_present": false,
        "model_persisted": false,
        "predictive_metrics": null,
        "ml_errors": [],
        "ml_accuracy": 1.0,
        "ml_pipeline_compliance_score": 1.0,
        "model_performance": null
      },
      "insight_metrics": {
        "insight_grounding_accuracy": 1.0,
        "supported_claim_count": 1,
        "unsupported_claim_count": 0,
        "fabricated_numeric_claim_count": 0,
        "total_insights_evaluated": 1,
        "insight_errors": [],
        "grounding_accuracy": 1.0
      },
      "report_metrics": {
        "report_fidelity_accuracy": 1.0,
        "pdf_generated": true,
        "pptx_generated": true,
        "facts_verified_count": 6,
        "facts_total_count": 6,
        "factual_mismatches": []
      },
      "runtime": {
        "total_runtime_seconds": 12.759,
        "intelligence_runtime": 0.018,
        "cleaning_runtime": 0.024,
        "eda_runtime": 10.417,
        "ml_runtime": 0.002,
        "insight_runtime": 2.019,
        "report_runtime": 0.262,
        "stage_timings": {
          "validation": 0.013,
          "intelligence": 0.018,
          "cleaning": 0.024,
          "eda": 10.417,
          "ml": 0.002,
          "insight": 2.019,
          "report": 0.262,
          "total_pipeline": 12.759
        }
      },
      "token_usage": {
        "status": "unavailable",
        "prompt_tokens": null,
        "completion_tokens": null,
        "total_tokens": null,
        "calls_count": 0,
        "stage_breakdown": {},
        "limitation_note": "Token metrics unavailable: Pipeline executed with deterministic heuristic fallbacks or local provider without exact token telemetry."
      },
      "baseline_comparison": {
        "status": "YDATA_PROFILING_UNAVAILABLE",
        "framework": "ydata-profiling",
        "comparable_metrics": {
          "row_count": 6,
          "column_count": 9,
          "quality_score": 98
        },
        "limitation_note": "ydata-profiling is not installed in the runtime environment. Per Section 15, benchmark comparison records YDATA_PROFILING_UNAVAILABLE and continues cleanly without modifying dependencies."
      },
      "errors": [
        {
          "column": "discount_pct",
          "predicted_label": "quantity",
          "expected_labels": [
            "percentage"
          ],
          "confidence": 0.9,
          "reason": "Predicted 'quantity' does not match expected ['percentage']"
        },
        {
          "column": "status",
          "predicted_label": "target_label",
          "expected_labels": [
            "category",
            "status"
          ],
          "confidence": 0.9,
          "reason": "Predicted 'target_label' does not match expected ['category', 'status']"
        }
      ]
    },
    {
      "dataset": "healthcare_patients",
      "domain": "healthcare",
      "rows": 6,
      "columns": 8,
      "pipeline_status": "completed",
      "semantic_label_accuracy": 1.0,
      "domain_accuracy": 1.0,
      "date_resolution_accuracy": 1.0,
      "pii_recall": 1.0,
      "pii_metrics": {
        "pii_true_positive": 0,
        "pii_false_negative": 0,
        "pii_false_positive": 0,
        "pii_recall": 1.0,
        "pii_precision": 1.0,
        "raw_pii_leakage_count": 5,
        "leakage_detected": true,
        "pii_columns_detected": [],
        "pii_columns_expected": [],
        "pii_errors": []
      },
      "cleaning_metrics": {
        "cleaning_accuracy": 1.0,
        "duplicates_removed": 0,
        "missing_values_before": 3,
        "missing_values_after": 1,
        "dtype_corrections": 0,
        "row_count_before": 6,
        "row_count_after": 6,
        "cleaning_passed": true,
        "cleaning_errors": []
      },
      "eda_metrics": {
        "eda_accuracy": 1.0,
        "stats_verified_count": 4,
        "stats_total_count": 4,
        "charts_generated_count": 6,
        "charts_verified": true,
        "pii_excluded_from_eda": true,
        "eda_errors": []
      },
      "ml_metrics": {
        "ml_behavior_compliance_score": 1.0,
        "model_training_status": "SKIPPED_INSUFFICIENT_DATA",
        "ml_ran": false,
        "ml_applicable_expected": false,
        "target_matched": true,
        "task_type_matched": true,
        "metrics_present": false,
        "model_persisted": false,
        "predictive_metrics": null,
        "ml_errors": [],
        "ml_accuracy": 1.0,
        "ml_pipeline_compliance_score": 1.0,
        "model_performance": null
      },
      "insight_metrics": {
        "insight_grounding_accuracy": 0.0,
        "supported_claim_count": 0,
        "unsupported_claim_count": 1,
        "fabricated_numeric_claim_count": 1,
        "total_insights_evaluated": 1,
        "insight_errors": [
          {
            "insight_index": 0,
            "cited_number": 100.0,
            "error": "Cited number 100.0 is not grounded in DIO facts or summary statistics"
          }
        ],
        "grounding_accuracy": 0.0
      },
      "report_metrics": {
        "report_fidelity_accuracy": 1.0,
        "pdf_generated": true,
        "pptx_generated": true,
        "facts_verified_count": 6,
        "facts_total_count": 6,
        "factual_mismatches": []
      },
      "runtime": {
        "total_runtime_seconds": 12.668,
        "intelligence_runtime": 0.015,
        "cleaning_runtime": 0.022,
        "eda_runtime": 10.381,
        "ml_runtime": 0.002,
        "insight_runtime": 2.016,
        "report_runtime": 0.218,
        "stage_timings": {
          "validation": 0.008,
          "intelligence": 0.015,
          "cleaning": 0.022,
          "eda": 10.381,
          "ml": 0.002,
          "insight": 2.016,
          "report": 0.218,
          "total_pipeline": 12.668
        }
      },
      "token_usage": {
        "status": "unavailable",
        "prompt_tokens": null,
        "completion_tokens": null,
        "total_tokens": null,
        "calls_count": 0,
        "stage_breakdown": {},
        "limitation_note": "Token metrics unavailable: Pipeline executed with deterministic heuristic fallbacks or local provider without exact token telemetry."
      },
      "baseline_comparison": {
        "status": "YDATA_PROFILING_UNAVAILABLE",
        "framework": "ydata-profiling",
        "comparable_metrics": {
          "row_count": 6,
          "column_count": 8,
          "quality_score": 94
        },
        "limitation_note": "ydata-profiling is not installed in the runtime environment. Per Section 15, benchmark comparison records YDATA_PROFILING_UNAVAILABLE and continues cleanly without modifying dependencies."
      },
      "errors": [
        {
          "insight_index": 0,
          "cited_number": 100.0,
          "error": "Cited number 100.0 is not grounded in DIO facts or summary statistics"
        }
      ]
    },
    {
      "dataset": "financial_loans",
      "domain": "finance",
      "rows": 6,
      "columns": 6,
      "pipeline_status": "completed",
      "semantic_label_accuracy": 0.8333,
      "domain_accuracy": 1.0,
      "date_resolution_accuracy": 1.0,
      "pii_recall": 1.0,
      "pii_metrics": {
        "pii_true_positive": 0,
        "pii_false_negative": 0,
        "pii_false_positive": 0,
        "pii_recall": 1.0,
        "pii_precision": 1.0,
        "raw_pii_leakage_count": 0,
        "leakage_detected": false,
        "pii_columns_detected": [],
        "pii_columns_expected": [],
        "pii_errors": []
      },
      "cleaning_metrics": {
        "cleaning_accuracy": 1.0,
        "duplicates_removed": 0,
        "missing_values_before": 0,
        "missing_values_after": 0,
        "dtype_corrections": 0,
        "row_count_before": 6,
        "row_count_after": 6,
        "cleaning_passed": true,
        "cleaning_errors": []
      },
      "eda_metrics": {
        "eda_accuracy": 1.0,
        "stats_verified_count": 4,
        "stats_total_count": 4,
        "charts_generated_count": 6,
        "charts_verified": true,
        "pii_excluded_from_eda": true,
        "eda_errors": []
      },
      "ml_metrics": {
        "ml_behavior_compliance_score": 1.0,
        "model_training_status": "SKIPPED_INSUFFICIENT_DATA",
        "ml_ran": false,
        "ml_applicable_expected": false,
        "target_matched": true,
        "task_type_matched": true,
        "metrics_present": false,